{
  "$schema": "https://json-schema.org/draft/2020-12/schema",
  "$id": "https://getmaipai.github.io/shared/spec/schemas/stack-job.schema.json",
  "title": "StackJob",
  "description": "A unit of work the Stack drives for Home: a generator render (image, video, music), a download, an engine install. Submitted once, watched on the event feed (job.progress, job.done), cancelled by id, its result fetched by id. A generator job waits in its role's queue (`position`, 1-based) until the governor admits it; a job the budget refuses fails with the governor's reason.",
  "type": "object",
  "additionalProperties": false,
  "required": ["id", "kind", "role", "state", "percent", "completedBytes", "totalBytes", "status", "position", "input", "result", "reason", "createdAt", "updatedAt"],
  "properties": {
    "id": { "type": "string", "minLength": 1 },
    "kind": { "type": "string", "minLength": 1, "description": "The runner's kind: a generator role id (`image`), or a Stack task (`model.install`, `engine.install`, `engine.stage`)." },
    "role": { "type": ["string", "null"], "description": "The role the job serves, when it serves one." },
    "state": { "type": "string", "enum": ["queued", "running", "done", "failed", "cancelled"] },
    "percent": { "type": "integer", "minimum": 0, "maximum": 100 },
    "completedBytes": { "type": "integer", "minimum": 0 },
    "totalBytes": { "type": "integer", "minimum": 0 },
    "status": { "type": "string", "description": "A short phrase for the current step (`downloading`, `waiting for memory`, `rendering`)." },
    "position": { "type": ["integer", "null"], "minimum": 1, "description": "The job's place in its role's queue while `queued`, null otherwise." },
    "input": { "type": ["object", "null"], "description": "What was submitted, as given." },
    "result": { "description": "What the runner returned when `done`; a generator returns `{ images: [{ b64_json }] }`." },
    "reason": { "type": ["string", "null"], "description": "Why the job failed or was cancelled." },
    "createdAt": { "type": "string", "format": "date-time" },
    "updatedAt": { "type": "string", "format": "date-time" }
  }
}
