{"id":"job-2f1c","kind":"image","role":"image","state":"queued","percent":0,"completedBytes":0,"totalBytes":0,"status":"queued","position":2,"input":{"prompt":"a lighthouse at dusk","size":"512x512"},"result":null,"reason":null,"createdAt":"2026-09-20T12:00:00.000Z","updatedAt":"2026-09-20T12:00:00.000Z"}
