{"id":"job-2f1c","kind":"image","role":"image","state":"done","percent":100,"completedBytes":0,"totalBytes":0,"status":"done","position":null,"input":{"prompt":"a lighthouse at dusk"},"result":{"images":[{"b64_json":"iVBORw0KGgo="}]},"reason":null,"createdAt":"2026-09-20T12:00:00.000Z","updatedAt":"2026-09-20T12:00:41.000Z"}
